ID,Topic,Coherence,Coherence+eps,PMI,NPMI,Cosine,KL,Euclidean,Jaccard,Variability,Post Variability
1,hitter season player braves team pitcher defensive score coach flyers,-72.70901183627403,-157.55785651661563,21.548896726550236,0.5042495452440817,0.9984717743991343,0.0015795586113510637,0.0012014486141697126,0.23746959383016028,3.1712203889067747e-06,0.10739830837666056
2,apartment rape neighbor woman soldier armenians father daughter beat harm,-74.46548557276559,-77.84259197983515,40.97767841920185,0.5292356482147611,0.9987233394205829,0.0013878302957190313,0.0010832709868669568,0.25327285290287066,3.513581153280816e-06,0.1207548027383496
3,detroit winnipeg leafs pt wings rangers playoff hockey philadelphia nhl,-59.18635326240652,-61.870611451001906,61.85274553177171,0.545600653642008,0.9986950634468762,0.001328715095471824,0.0010733571345047364,0.29514165981302065,2.294808293165726e-06,0.10929109703934087
4,format graphics ftp workstation server directory anonymous unix amiga database,-81.48444696640172,-83.9759273294134,38.375599475842876,0.5281418350714058,0.9991714295503307,0.0008538210321692823,0.0008655323133251572,0.20929412944808884,4.244363817958595e-06,0.11394721659756919
5,islamic sexual islam marriage jesus homosexual hitler marry sex religious,-84.87527099422725,-118.60032345465666,9.647403410084316,0.5042942487963696,0.998686269758553,0.0013593079723948263,0.0010904088181963524,0.24714731711602853,4.373134340205658e-06,0.11253560717294456
6,jpeg workstation format gif platform toolkit widget server ftp converter,-68.98071839041774,-72.82845907864487,25.10400182852983,0.5179737164200319,0.9992959960208213,0.0007291673860165339,0.0008046112958462748,0.2163025045402161,3.28781172680464e-06,0.11333509801190032
7,scripture revelation god doctrine belief christian truth morality jesus faith,-60.75903694631718,-62.79089123092837,28.28997689734759,0.5218272542455843,0.998798638333399,0.0012414247541456909,0.001054868721927049,0.3346687608663413,3.7413793138551807e-06,0.11513548693880542
8,jesus scripture eternal heaven god faith prophecy holy verse spirit,-71.38208955039012,-73.65509905718496,41.42469393559387,0.5306835969783028,0.9985559902084075,0.001490185200179755,0.0011584853676776816,0.3040446266545957,3.0219124561757395e-06,0.10099421254403847
9,israel jews turkish jew muslim turks lebanese arab armenian territory,-72.04647301439343,-102.31845711487817,0.20878837574584352,0.496985203856218,0.9987007895071005,0.001325024198366176,0.0011024469076364527,0.3013858105062987,4.478051082297351e-06,0.11667716050148157
10,bio rom controller interface disk processing floppy widget application jumper,-99.55230782102659,-161.21957064372157,-26.748657470439902,0.4720507089966963,0.9989565502244175,0.0010613418858658333,0.0009862736320331163,0.13480556659224094,3.9371360737988985e-06,0.11679659962659056
11,bike amp helmet manual honda turbo brake tire rear voltage,-130.1978194238683,-495.41328791770326,-114.59052491863108,0.36916836844923145,0.9985123983865861,0.0015564758179580757,0.0011571345734093783,0.15045132848702816,2.440425499442536e-06,0.10273239994587284
12,pitcher braves player baseball hitter pitch jesus defensive season deserve,-84.70517808670631,-170.69855472230012,-9.97669434294558,0.48488243289818667,0.9983768035828701,0.0017069843064425492,0.0012244235186231463,0.22285555453416334,3.4871389744250913e-06,0.10308106583570567
13,motherboard meg screen windows printer mouse modem port gateway quadra,-104.9220543853093,-110.37366127388528,1.6885232021724441,0.4979469685946218,0.9987710159882113,0.0012341219099805622,0.0010396338399231311,0.15922981289919966,3.3345507567712353e-06,0.10792244946808101
14,holy jesus belief god atheist religious doctrine religion atheism spirit,-68.00714093766355,-69.48332892808895,27.506726273726336,0.5210830831802956,0.9989068972232229,0.0011142904674347085,0.0010097570149743855,0.28971891455001714,2.8216333788158375e-06,0.10182793519225126
15,enforcement privacy encrypt device serial encryption americans wiretap ripem law,-70.13239846147715,-73.61715356519001,12.089008862247777,0.5070275818358515,0.9991474507439306,0.0008781138757198052,0.0008936197840617279,0.18443049816490042,3.6259665579884373e-06,0.12150819011940206
16,militia assault crime criminal constitution homicide firearm weapon amendment commit,-60.16578447570528,-63.56286803797702,37.93746203714556,0.5288821404070047,0.999035561997835,0.0009979317733899993,0.0009631447564734937,0.22961654445170993,3.7726037853498133e-06,0.1111701789902034
17,satellite spacecraft remote mission module anonymous shuttle sequence launch lunar,-74.97761013754963,-79.51770926121813,26.18759466810154,0.5156702209840794,0.9992246572642216,0.0008125173447581774,0.0008399130064753211,0.18538075748804442,3.568794256778233e-06,0.11693904150263082
18,ide windows scsus scsi meg ram motherboard upgrade printer quadra,-78.38189045652483,-80.99633713839324,34.31904580401792,0.5256318401444017,0.9988662686769143,0.0011056719206551558,0.0010056403336963571,0.17765631172033133,3.493655003633873e-06,0.11547972864021282
19,turks israel turkish civilian armenian greek lebanon village muslim lebanese,-76.20875601593563,-162.16296964280338,-9.708662310514384,0.4867416850644572,0.9988437222635739,0.0011846488901481578,0.0010422572035618293,0.5930108905212328,3.7074460560374046e-06,0.11094148490572558
20,god christ faith christian jesus bible resurrection belief revelation existence,-65.09187528592335,-66.04308701306633,31.719494072773763,0.524662123069,0.9988621174800124,0.0011652245985350966,0.0010191867792268014,0.3626734566401701,3.695426305094372e-06,0.11140660649252154
21,circuit nec voltage install wire cable amp panel bike outlet,-105.49509818643139,-167.53327729788558,-23.649389949917943,0.47535397603289675,0.998562390413385,0.0014798287598712834,0.0011304049154617225,0.09815444874877624,2.6255601126956657e-06,0.10559410411639951
22,cpu os menu xterm xlib pixel cache hardware mac font,-87.34922804628765,-120.6488207955865,7.640556688999659,0.5021727311407945,0.9989043442493315,0.0011194969141514956,0.0010023202502978763,0.13319305757277927,3.8415928314384e-06,0.11474951399576205
23,tor det calgary pit pt que cal montreal buf mon,-43.102427747585956,-46.83996276059207,70.54239585764624,0.5505354979571487,0.9985702310956099,0.0014813291286548038,0.0011165917527624122,0.36457441447011024,2.3078069059144323e-06,0.1091151746639612
24,file output militia entry oname char printf buf firearm io,-106.0137871716085,-279.99388301758773,-137.90693325245374,0.36931280825193524,0.9991647585338442,0.0008824630711596709,0.0008889900464999677,0.12874807928745888,3.091239044893081e-06,0.11635083595736719
25,motherboard ide hd scsus circuit meg scsi shipping ram cable,-79.68558882068372,-85.13982067805327,5.268697469324868,0.4992838757232789,0.99867193424858,0.0013163094637638087,0.001085427971247184,0.17726506489903365,3.180872817424399e-06,0.10806740338862575
26,db mov int bh byte null echo char oname cs,-84.34902737814993,-536.8908822207234,-162.5873636229503,0.32840955647789105,0.9993293664080783,0.0006952606494455847,0.0007738608019099603,0.1509686631429774,2.9357524808871445e-06,0.12055016646295982
27,privacy administration encryption enforcement conduct americans wiretap device escrow agency,-58.864989980784216,-60.31252504371625,51.025813447771576,0.5385028819583288,0.9990425770540808,0.0010074778226688396,0.0009462639707244849,0.1580742074927111,3.2441087077480922e-06,0.11081495993623314
28,god revelation scripture doctrine faith christ bible christian belief jesus,-47.87595106519323,-48.7818911224,42.73199891296787,0.5333027384407598,0.9987529486775667,0.0012682560827521753,0.001074430684194121,0.33199666372778824,3.477524994059559e-06,0.10577150758879578
29,atheism atheist god passage belief moral conclusion doctrine islam religion,-73.82485223347408,-76.21773765306382,27.232407832757225,0.520255652315395,0.9989342973075562,0.0010952660592604495,0.0009931692375796707,0.2881284974659807,3.47283684980489e-06,0.11162122496290683
30,armenians son armenian daughter rape armenia turks murder massacre soldier,-56.0399966692373,-58.05681228255241,56.48990050365486,0.5424312621759365,0.99855716917022,0.0015315400277915387,0.0011580794933508383,0.34136554530538415,3.910152279948682e-06,0.10283965479035176
31,jews muslims turkish jew muslim turks israel armenian lebanese village,-71.59296571789169,-102.44411712597669,4.492141530933222,0.49996990320231477,0.9986455109322158,0.0014291363314461142,0.0010984811423476535,0.20781759665794122,4.516155120307029e-06,0.10371768556757271
32,nhl puck hockey season league penalty playoff flyers cup draft,-72.77316666369126,-75.41387258141079,51.24738753528392,0.5380761354924306,0.9986972003270815,0.0013520363551988604,0.001088289267953888,0.23962291642375674,2.508346187887846e-06,0.11193204951402631
33,widget converter xt export toolkit server directory binary dec resource,-77.12100385599543,-81.95329965807808,30.64184570078321,0.5216286160907225,0.9992972691233368,0.0007360163663295507,0.0007963559776706032,0.2648109496149949,3.1479858850253777e-06,0.1111003270409251
34,cipher ripem privacy encrypt cryptography des security enforcement rsa serial,-57.3393267774515,-61.97584100887965,47.460254375128315,0.5348854693099004,0.9992310879497444,0.0007928095306284636,0.0008485979018499944,0.26042612071957,4.122591080111848e-06,0.121047282206925
35,homicide batf criminal abuse knife gun gang crime violent assault,-73.1723106645401,-132.63009328818853,36.64497610774853,0.5227013361043955,0.9985669853394016,0.0014773715406473193,0.0011682797285464128,0.13235582529942932,3.8669388755338475e-06,0.10552355881551047
36,entry remark output winner char contest oname printf buf int,-92.18129380825079,-101.58107814536888,-1.1478877460742751,0.4994226667872824,0.9991559009814251,0.0008820539554317027,0.0008694141649772173,0.24811913349133724,2.383578521592662e-06,0.11586063251883223
37,stephanopoulos secretary sector president congress russia administration senate community resolution,-61.43586447938041,-66.98103221490494,21.054339272715453,0.5162552647163611,0.9989414751052433,0.0011418321906336445,0.0009999042857806895,0.1852500765423017,5.2129931068240895e-06,0.10821379768453541
38,motherboard hd ide connector jumper meg modem mode mb scsus,-80.25004697785087,-83.95014989860498,37.20560454816355,0.5268542005206813,0.9988283341733916,0.001169168367608067,0.001023906088817291,0.172295407822771,4.229980146875614e-06,0.11051177376548255
39,det tor buf que pit calgary detroit cal pt min,-45.71624430596891,-49.86490745930752,68.50762914958396,0.5488351795974626,0.9987062375247959,0.0013304276847672161,0.0010717539619896003,0.2774913743867421,3.4910471308133293e-06,0.11204932724568432
40,interface mb scsi scsus vga cache ide disk controller ram,-59.39355048171509,-61.02497555596635,43.794124129794014,0.5331328455268481,0.9988824010123735,0.0010947191211489991,0.0010036529498969485,0.19848376802974513,2.9198102599495396e-06,0.11409746414436507
41,probe spacecraft mission conduct shuttle map lunar scientific saturn schedule,-76.15398025259778,-80.94146340474116,49.413022414676206,0.5350703688205612,0.9991741318113451,0.0008589438342157831,0.0008844766037070395,0.1821248938741851,4.029749441464996e-06,0.11504563780765299
42,ide motherboard mhz meg gateway quadra isa scsi simm scsus,-73.09025113144156,-76.57694708763685,36.23551543756095,0.5227613611489128,0.9988472973420987,0.0011883529055635828,0.001023276929876048,0.1522343340103922,4.004480081945918e-06,0.1091085472605657
43,apartment woman neighbor armenians rape father soldier february daughter troops,-60.817207305582485,-63.153641059325274,54.45309962090573,0.5392878885716951,0.9987376649977577,0.0013479936479426533,0.0010864545126357636,0.30517295129238403,3.5607248830459954e-06,0.11501144002015697
44,stephanopoulos myers president package congress decision secretary senate february gay,-85.50203139307197,-123.16760891736875,-2.7150289701731065,0.4959596402515923,0.9990496891976656,0.0010232866547914337,0.0009507479088097123,0.17392610875198372,4.1866350124321395e-06,0.10904736389295194
45,mb interface controller disk floppy bio scsi ram scsus rom,-77.36118976454874,-79.67670745152628,40.36676986012187,0.530040068488657,0.9990633036526644,0.0009318067924134547,0.0009201486635968631,0.19139594433657797,4.083108108731568e-06,0.10811287319879784
46,village turkish armenian armenians armenia genocide minority greek muslim turkey,-41.24252659849807,-42.48355939089409,50.03920418794841,0.5385893480736882,0.9988996098475127,0.0011370698575169935,0.0010166396037435141,0.5306459226066178,4.101728567347814e-06,0.11439067964805893
47,satellite module launch probe sequence spacecraft capability remote culture conduct,-92.633048227673,-154.64946614367508,7.477645645364905,0.49819774263591954,0.999248734711613,0.0007880344117268612,0.0008374415203108333,0.2845417286786947,3.114436943557319e-06,0.11900674046562075
48,det tor winnipeg detroit mw pp rg cal eus pit,-86.4101880350797,-504.97459667998,-113.03941187901553,0.33858734648999245,0.9986976330441621,0.0013266296782824627,0.001085185047716146,0.2455375424335796,2.8566742495355927e-06,0.1074813733697885
49,coach team hitter season braves score player pitch playoff pitcher,-57.76332851380898,-60.42115556392063,50.9738716140515,0.53841207831228,0.9983792235596474,0.001681643152528216,0.0012286526931917382,0.2557355312279457,3.010937521267681e-06,0.10721322397802184
50,israel israeli arab militia arabs palestinian lebanese islamic jew lebanon,-54.76873490070732,-57.340073604931284,57.06942837760836,0.5431950956863101,0.9987976436082682,0.0012366817639875754,0.0010614562947104797,0.2998940095573233,4.794520364408256e-06,0.10358027630354691
